{
  "enabled": true,
  "mode": "teacher-student",
  "language": "zh-TW",
  "scriptApprovalRequired": true,
  "voices": {
    "teacher": {
      "label": "測試女老師",
      "provider": "mock",
      "voiceId": "mock-teacher",
      "speed": 0.95
    },
    "student": {
      "label": "測試男學員",
      "provider": "mock",
      "voiceId": "mock-student",
      "speed": 1.0
    }
  },
  "subtitle": {
    "enabled": true,
    "format": "both",
    "burnIn": true,
    "fontFamily": "Microsoft JhengHei",
    "fontSize": 48,
    "position": "bottom",
    "outline": 3
  },
  "video": {
    "width": 1920,
    "height": 1080,
    "fps": 30,
    "format": "mp4",
    "holdAfterSlideSeconds": 1
  }
}
